{
  "proposal_id": "d8000833-27b3-51a0-aefb-b172aea6a358",
  "decision_type": "deliver_resource",
  "selected_proposal_ids": [
    "cbeb0cfd-37a1-5df0-b4e4-8c7d030fe299",
    "fa4bc506-6e7d-5b96-b43f-7921f4f57fb4",
    "acecef7c-8beb-5553-9cdc-6beedca1dac5",
    "38c52ab1-53d7-5f86-9da5-56fb5844c0ec"
  ],
  "rejected_proposals": [],
  "target_knowledge_node_ids": [
    "RAG-M05-N04",
    "RAG-M07-N03"
  ],
  "rationale_summary": "诊断、路径、资源与测评均符合冻结Schema；审核通过且关键陈述有证据支持。",
  "supporting_evidence_ids": [
    "b04e4952-9eb2-502e-9cfe-41d8bd62bc49",
    "82baf3c7-5e46-5051-9dc0-ca20b8b92ff6",
    "36517c9a-c0cd-5c02-a8ba-8efdaf33764a",
    "56475a80-f5aa-571b-96a9-5cf4a4a59630"
  ],
  "confidence": 0.9017,
  "requires_human_review": false,
  "human_review_reason": null
}
