{
  "proposal_id": "f1511111-1111-4111-8111-111111111111",
  "decision_type": "deliver_resource",
  "selected_proposal_ids": [
    "f2111111-1111-4111-8111-111111111111",
    "f3111111-1111-4111-8111-111111111111",
    "f1111111-1111-4111-8111-111111111111"
  ],
  "rejected_proposals": [],
  "target_knowledge_node_ids": [
    "linked_list_pointer"
  ],
  "rationale_summary": "资源提案已通过审核，且与诊断和路径目标一致。",
  "supporting_evidence_ids": [
    "fd111111-1111-4111-8111-111111111111"
  ],
  "confidence": 0.91,
  "requires_human_review": false,
  "human_review_reason": null
}
